{"event_uid":"0xeef4db66cd5fb2f612f5295553d192ed3b9754ed75ec58fec0f814a85a13437f","event_revision":1,"oracle_version":1,"geo_resolution":7,"cells_generation_method":"shakemap_gridxml_h3_grid_point_p90_v1","cell_metric":"USGS_MMI","cell_aggregation":"GRID_POINT_P90","intensity_scale":"MMI_X100","affected_cells":[{"h3_index":"608692970719281151","intensity_value":723,"cell_band":1},{"h3_index":"608692970719543295","intensity_value":831,"cell_band":2}]}